benchmark_name,feasibility_class,direct_arrivals_available,input_available,output_available,session_available,tool_calls_available,timestamp_available,synthetic_fields_needed,estimated_effort,suitability_rank,notes,source_urls
GSM8K,payload_only,no,partial,no,no,no,no,arrival timestamps;concurrency model;output length model;session ID;tenant ID;LoRA adapter ID;prefix ID;SLO class;API latency;cancellation probability;priority tier;heterogeneity label;P/D routing annotations,low,47,"8.5K problems (7.5K train/1K test) with chain-of-thought solutions = moderate decode length; short prompts good for arrival/concurrency. DEPRECATION: repo archived/read-only Apr 8 2026. Widely cited MIT.",https://github.com/openai/grade-school-math
MATH,payload_only,no,yes,yes,no,no,no,arrival timestamps;concurrency model;output length model;session ID;tenant ID;LoRA adapter ID;prefix ID;SLO class;API latency;cancellation probability;priority tier;heterogeneity label;P/D routing annotations,low,48,"Verified mirror MATH-500 = 500 test rows with problem/solution/answer; long step-by-step solutions = longer decode; short-medium prompts ok for concurrency. Full MATH off-repo. MIT.",https://github.com/hendrycks/math;https://huggingface.co/datasets/HuggingFaceH4/MATH-500
Big-Bench,payload_only,no,yes,yes,no,no,no,arrival timestamps;concurrency model;output length model;session ID;tenant ID;LoRA adapter ID;prefix ID;SLO class;API latency;cancellation probability;priority tier;heterogeneity label;P/D routing annotations,low,49,"200+ JSON tasks with input/target prompts (BBL = 24-task subset); mostly short single-shot prompts good for synthetic arrival/concurrency. DEPRECATION: repo archived/read-only Apr 17 2026. Apache-2.0.",https://github.com/google/BIG-bench
BBH (BIG-Bench-Hard),payload_only,no,yes,no,no,no,no,arrival timestamps;concurrency model;output length model;session ID;tenant ID;LoRA adapter ID;prefix ID;SLO class;API latency;cancellation probability;priority tier;heterogeneity label;P/D routing annotations,low,50,"Data public via HF mirror maveriq/bigbenchhard (MIT, 6511 rows, 23 tasks, input/target). CoT prompts in source repo. Short single-shot prompts good for concurrency. GitHub source repo 404 on all fetches (cannot verify stars/license directly).",https://huggingface.co/datasets/maveriq/bigbenchhard;https://github.com/suzgun/BIG-Bench-Hard
AgentBench,schema_only,no,partial,no,partial,yes,no,arrival timestamps;concurrency model;output length model;session ID;tenant ID;LoRA adapter ID;prefix ID;SLO class;API latency;cancellation probability;priority tier;heterogeneity label;P/D routing annotations,high,51,"8 environments via Docker Compose (WebShop/ALFWorld/KG/OS etc.); configs+prompts present but NO sample trajectory files in repo. KG needs external Freebase. Request-level tool-call loops must be GENERATED by running against task servers. Apache-2.0.",https://github.com/THUDM/AgentBench
OSWorld,schema_only,no,partial,no,no,yes,no,arrival timestamps;concurrency model;output length model;session ID;tenant ID;LoRA adapter ID;prefix ID;SLO class;API latency;cancellation probability;priority tier;heterogeneity label;P/D routing annotations,high,52,"Requires VM (VMware/VirtualBox/Docker+KVM/AWS), some tasks need client VM sudo. V2 task classes in a GATED HF dataset; tasks in-repo but no raw prompt text on page; outputs (screenshots/actions/video) GENERATED to ./results, not pre-supplied. Apache-2.0.",https://github.com/xlang-ai/OSWorld;https://huggingface.co/datasets/xlangai/osworld_v2_tasks
WorkArena,schema_only,no,partial,no,no,yes,no,arrival timestamps;concurrency model;output length model;session ID;tenant ID;LoRA adapter ID;prefix ID;SLO class;API latency;cancellation probability;priority tier;heterogeneity label;P/D routing annotations,high,53,"needs-live-environment + GATING: requires a ServiceNow instance; access via gated HF ServiceNow/WorkArena-Instances. L1=19912 instances/33 tasks, WorkArena++=682 tasks. Demos are videos not text trajectories. Per-request browser trace GENERATED against live instance. Apache-2.0.",https://github.com/ServiceNow/WorkArena;https://github.com/ServiceNow/WorkArena/blob/main/LICENSE
GAIA,schema_only,no,partial,no,no,partial,no,arrival timestamps;concurrency model;output length model;session ID;tenant ID;LoRA adapter ID;prefix ID;SLO class;API latency;cancellation probability;priority tier;heterogeneity label;P/D routing annotations,high,54,"GATED: HF dataset requires accepting contact-sharing + no-reshare; login required so questions/answers NOT visible on card. ~450+ questions, dev public / test answers private. No license on card. Trace must be GENERATED by running an agent (tool loops vary by harness).",https://huggingface.co/datasets/gaia-benchmark/GAIA
MiniWoB++,schema_only,no,partial,no,no,yes,no,arrival timestamps;concurrency model;output length model;session ID;tenant ID;LoRA adapter ID;prefix ID;SLO class;API latency;cancellation probability;priority tier;heterogeneity label;P/D routing annotations,high,55,"needs-live-environment: Selenium WebDriver + Chrome. Gymnasium API (no dedicated eval scripts). utterances/instructions per env but no full prompt list or trajectory files shipped. Very short single-step interactions (low KV/context growth). Per-step trace GENERATED by stepping env. MIT.",https://github.com/Farama-Foundation/miniwob-plusplus
SWE-Lancer,schema_only,no,partial,no,partial,partial,no,arrival timestamps;concurrency model;output length model;session ID;tenant ID;LoRA adapter ID;prefix ID;SLO class;API latency;cancellation probability;priority tier;heterogeneity label;P/D routing annotations,high,56,"Original openai/SWELancer-Benchmark ARCHIVED/read-only (Jul 18 2025), redirects to openai/preparedness. Dataset hosting/gating not confirmed (Git LFS, dataset_public=maybe). Freelance SWE tasks with e2e tests are inherently agentic multi-step. MIT. arXiv id 2502.12115 UNVERIFIED.",https://github.com/openai/SWELancer-Benchmark;https://github.com/openai/preparedness
2WikiMultihopQA,schema_only,no,partial,no,no,no,no,arrival timestamps;concurrency model;output length model;session ID;tenant ID;LoRA adapter ID;prefix ID;SLO class;API latency;cancellation probability;priority tier;heterogeneity label;P/D routing annotations,high,57,"NO official HuggingFace dataset; data only via Dropbox links from GitHub (data.zip). GitHub describes format (question/context/supporting_facts/evidences/answer) but raw rows and gold answers NOT shown on page (must download). Size/length stats not stated. cc-by-4.0.",https://github.com/Alab-NII/2wikimultihop
GPQA,schema_only,no,partial,no,no,no,no,arrival timestamps;concurrency model;output length model;session ID;tenant ID;LoRA adapter ID;prefix ID;SLO class;API latency;cancellation probability;priority tier;heterogeneity label;P/D routing annotations,high,58,"GATED: must agree to share contact info; login + accept conditions required; agreement forbids revealing examples in plain text online. 448 MCQs; short prompts ok for concurrency but access-gated. CC-BY-4.0.",https://huggingface.co/datasets/Idavidrein/gpqa
Azure Functions Trace 2019,not_suitable,yes,no,no,no,no,yes,output length model;input length model;session ID;tenant ID;LoRA adapter ID;prefix ID;SLO class;API latency;cancellation probability;priority tier;heterogeneity label;P/D routing annotations,low,59,"ARRIVAL-PROCESS DONOR ONLY: function invocation counts/triggers + execution-time + memory distributions. NO token lengths, NO LLM payload. Frequently used (AlpaServe) to simulate realistic cloud arrival burstiness. Not a standalone request trace but valuable to graft arrivals onto payload_only datasets. CC-BY-4.0.",https://github.com/Azure/AzurePublicDataset/blob/master/AzureFunctionsDataset2019.md
BrowserArena,not_suitable,no,no,no,no,no,no,not applicable (no public code or data),high,60,"NOT PUBLIC: github.com/web-arena-x/BrowserArena returns HTTP 404; GitHub search 0 results. Exists only as arXiv 2510.02418 (UPenn) - a LIVE Arena-style open-web platform with user-submitted tasks + human feedback, no repo or downloadable dataset. Not reproducible offline. DROP.",https://github.com/web-arena-x/BrowserArena;https://arxiv.org/abs/2510.02418
